{
  "schema-version": 1,
  "generated-at": "2026-05-24T15:14:16.632Z",
  "sources": {
    "system-readiness": "benchmark/system-readiness.generated.json",
    "skill-investment-backlog": "registry/skill-investment-backlog.generated.json",
    "pending-scaffolds": "registry/pending-scaffolds.generated.json",
    "admission-ledger": "registry/admission-ledger.generated.json"
  },
  "status": "ready",
  "capabilities": {
    "create-authoritative-skill": "available",
    "materialize-pending-scaffold": "idle",
    "rewrite-generated-governance": "available"
  },
  "summary": {
    "active-constraints": 0,
    "blocked-governance-artifacts": 0,
    "pending-scaffolds": 0,
    "blocked-admissions": 0,
    "host-writeability-backlog-items": 0,
    "top-tier-next-wave-size": 0,
    "top-tier-blocked-stable-skills": 0
  },
  "active-constraints": [],
  "pending-scaffolds": [],
  "blocked-admissions": [],
  "host-writeability-debt": [],
  "top-tier-execution-focus": {
    "blocked": 0,
    "next-wave": [],
    "next-wave-size": 0,
    "current-priority-lane": null,
    "current-blocker-family": null,
    "follow_up": [
      "node personal-skill-system/skills/tools/manage-skill/scripts/run.js assess-top-tier --all",
      "node personal-skill-system/skills/tools/manage-skill/scripts/run.js show-top-tier-wave",
      "node personal-skill-system/skills/tools/manage-skill/scripts/run.js show-investment-backlog --source top-tier-readiness"
    ]
  },
  "readiness": {
    "status": "ready",
    "generated-at": "2026-05-24T15:14:16.461Z",
    "host-writeability": {
      "status": "ready",
      "total": 36,
      "writable": 36,
      "blocked": 0,
      "critical": 0,
      "high": 0,
      "normal": 0,
      "artifacts": []
    },
    "top-tier-execution-focus": {
      "blocked": 0,
      "next-wave": [],
      "next-wave-size": 0,
      "current-priority-lane": null,
      "current-blocker-family": null,
      "follow_up": [
        "node personal-skill-system/skills/tools/manage-skill/scripts/run.js assess-top-tier --all",
        "node personal-skill-system/skills/tools/manage-skill/scripts/run.js show-top-tier-wave",
        "node personal-skill-system/skills/tools/manage-skill/scripts/run.js show-investment-backlog --source top-tier-readiness"
      ]
    }
  },
  "follow_up": [
    "node personal-skill-system/skills/tools/manage-skill/scripts/run.js assess-top-tier manage-skill"
  ],
  "notes": [
    "Generated from the current backlog, pending-scaffold registry, admission ledger, and live writeability probes.",
    "This artifact is host-specific recovery guidance for self-evolution, not a substitute for registry/backlog validation.",
    "Use it to understand whether future skill creation or generated-governance refreshes are blocked on the current runtime.",
    "When derived benchmark artifacts are blocked, export benchmark/system-readiness.generated.json and benchmark/host-evolution.generated.json through the governed export path before syncing them back via distribution."
  ]
}
